postTime,msgFrom,title,link,desc
2017/03/08,第四军医大学,唐都医院车队车场门禁系统安装工程招标公告-通知公告网,https://tongzhi.fmmu.edu.cn/info/1040/12251.htm,唐都医院车队车场门禁系统安装工程招标公告
2017/03/10,第四军医大学,军委训练管理部西安第五干休所“三个中心”及综合楼室内装修工程招标公告-通知公告网,https://tongzhi.fmmu.edu.cn/info/1040/12245.htm,军委训练管理部西安第五干休所“三个中心”及综合楼室内装修工程招标公告
2017/03/20,第四军医大学,关于手持式化学毒剂探测器等项目集中采购的公告公示-通知公告网,https://tongzhi.fmmu.edu.cn/info/1040/12275.htm,关于手持式化学毒剂探测器等项目集中采购的公告公示
2017/03/13,第四军医大学,第四军医大学第三附属医院医疗综合楼外立面、净化、智能化工程中标候选人公示 -通知公告网,https://tongzhi.fmmu.edu.cn/info/1040/12254.htm,第四军医大学第三附属医院医疗综合楼外立面、净化、智能化工程中标候选人公示
2017/03/24,第四军医大学,关于第四军医大学文印中心（非密）公开招标的公告公示-通知公告网,https://tongzhi.fmmu.edu.cn/info/1040/12284.htm,关于第四军医大学文印中心（非密）公开招标的公告公示
2017/03/13,第四军医大学,第四军医大学保洁服务项目招标公告-通知公告网,https://tongzhi.fmmu.edu.cn/info/1040/12262.htm,第四军医大学保洁服务项目招标公告
2017/03/17,第四军医大学,第四军医大学口腔医院物业管理服务项目招标公告-通知公告网,https://tongzhi.fmmu.edu.cn/info/1040/12272.htm,第四军医大学口腔医院物业管理服务项目招标公告
2016/11/30,第四军医大学,西京医院骨四科病区整修工程招标公告-通知公告网,https://tongzhi.fmmu.edu.cn/info/1040/12058.htm,西京医院骨四科病区整修工程招标公告
2016/12/19,第四军医大学,唐都医院干部公寓楼电梯采购及安装工程中标公示-通知公告网,https://tongzhi.fmmu.edu.cn/info/1040/12106.htm,唐都医院干部公寓楼电梯采购及安装工程中标公示
2016/11/10,第四军医大学,唐都医院家属区污水站改造工程招标公告-通知公告网,https://tongzhi.fmmu.edu.cn/info/1040/12029.htm,唐都医院家属区污水站改造工程招标公告
2016/12/07,第四军医大学,唐都医院中央空调更换初中效及亚高效过滤器项目招标公告-通知公告网,https://tongzhi.fmmu.edu.cn/info/1040/12073.htm,唐都医院中央空调更换初中效及亚高效过滤器项目招标公告
2017/01/09,第四军医大学,关于高等医学图书教材等设备器材集中采购结果的公告公示-通知公告网,https://tongzhi.fmmu.edu.cn/info/1040/12131.htm,关于高等医学图书教材等设备器材集中采购结果的公告公示
2017/01/09,第四军医大学,唐都医院2017年院内节日布置材料项目招标-通知公告网,https://tongzhi.fmmu.edu.cn/info/1040/12139.htm,唐都医院2017年院内节日布置材料项目招标
2017/03/29,第四军医大学,关于手持式化学毒剂探测器等项目集中采购二次公示-通知公告网,https://tongzhi.fmmu.edu.cn/info/1040/12311.htm,关于手持式化学毒剂探测器等项目集中采购二次公示
2016/12/20,第四军医大学,关于实验室专用气体等项目集中采购的公告公示-通知公告网,https://tongzhi.fmmu.edu.cn/info/1040/12109.htm,关于实验室专用气体等项目集中采购的公告公示
2012/05/08,第四军医大学,第四军医大学航空航天医学实验楼新建工程招标公告-通知公告网,https://tongzhi.fmmu.edu.cn/info/1040/8363.htm,第四军医大学航空航天医学实验楼新建工程招标公告
2012/05/25,第四军医大学,西京医院室内保洁服务招标公告-通知公告网,https://tongzhi.fmmu.edu.cn/info/1040/8356.htm,西京医院室内保洁服务招标公告
2017/01/10,第四军医大学,关于教学科研用试剂耗材等集中采购的公示-通知公告网,https://tongzhi.fmmu.edu.cn/info/1040/12143.htm,关于教学科研用试剂耗材等集中采购的公示
2016/03/23,第四军医大学,唐都医院中央空调更换冷却塔填料项目招标公告-通知公告网,https://tongzhi.fmmu.edu.cn/info/1040/11383.htm,唐都医院中央空调更换冷却塔填料项目招标公告
2016/03/28,第四军医大学,唐都医院核医学科PET/MR机房装修改造工程招标公告-通知公告网,https://tongzhi.fmmu.edu.cn/info/1040/11405.htm,唐都医院核医学科PET/MR机房装修改造工程招标公告
2016/03/31,第四军医大学,唐都医院干部公寓楼电梯采购及安装项目招标公告-通知公告网,https://tongzhi.fmmu.edu.cn/info/1040/11429.htm,唐都医院干部公寓楼电梯采购及安装项目招标公告
2016/03/29,第四军医大学,唐都医院医疗区绿篱补植树木采购招标公告-通知公告网,https://tongzhi.fmmu.edu.cn/info/1040/11414.htm,唐都医院医疗区绿篱补植树木采购招标公告
2016/03/28,第四军医大学,唐都医院核医学科中央空调采购及安装工程招标公告-通知公告网,https://tongzhi.fmmu.edu.cn/info/1040/11399.htm,唐都医院核医学科中央空调采购及安装工程招标公告
2012/01/06,第四军医大学,西京医院西京锦苑加建工程招标公告-通知公告网,https://tongzhi.fmmu.edu.cn/info/1040/8357.htm,西京医院西京锦苑加建工程招标公告
2016/04/19,第四军医大学,西京医院住院一部风机盘管、风道清洗消毒工程招标公告-通知公告网,https://tongzhi.fmmu.edu.cn/info/1040/11477.htm,西京医院住院一部风机盘管、风道清洗消毒工程招标公告
2016/04/12,第四军医大学,唐都医院核医学科屋面新做防水招标公告-通知公告网,https://tongzhi.fmmu.edu.cn/info/1040/11463.htm,唐都医院核医学科屋面新做防水招标公告
2016/05/16,第四军医大学,唐都医院保安员服装项目招标公告-通知公告网,https://tongzhi.fmmu.edu.cn/info/1040/11546.htm,唐都医院保安员服装项目招标公告
2016/04/25,第四军医大学,唐都医院医疗区物业管理招标公告-通知公告网,https://tongzhi.fmmu.edu.cn/info/1040/11495.htm,唐都医院医疗区物业管理招标公告
2016/05/18,第四军医大学,关于组织部分种植体集中采购公告 -通知公告网,https://tongzhi.fmmu.edu.cn/info/1040/11555.htm,关于组织部分种植体集中采购公告
2016/04/18,第四军医大学,唐都医院申请进入招标代理企业库企业报名公告-通知公告网,https://tongzhi.fmmu.edu.cn/info/1040/11469.htm,唐都医院申请进入招标代理企业库企业报名公告
2016/05/19,第四军医大学,唐都医院灭火器购买及检修工程招标公告-通知公告网,https://tongzhi.fmmu.edu.cn/info/1040/11568.htm,唐都医院灭火器购买及检修工程招标公告
2016/05/13,第四军医大学,关于“医学统计学”研究生慕课建设招标结果的公告公示-通知公告网,https://tongzhi.fmmu.edu.cn/info/1040/11536.htm,关于“医学统计学”研究生慕课建设招标结果的公告公示
2016/05/20,第四军医大学,唐都医院洗涤设备采购项目招标公告-通知公告网,https://tongzhi.fmmu.edu.cn/info/1040/11571.htm,唐都医院洗涤设备采购项目招标公告
2016/06/08,第四军医大学,唐都医院学员宿舍楼电源改造项目招标公告-通知公告网,https://tongzhi.fmmu.edu.cn/info/1040/11601.htm,唐都医院学员宿舍楼电源改造项目招标公告
2016/05/17,第四军医大学,唐都医院幼儿园维修改造工程招标公告-通知公告网,https://tongzhi.fmmu.edu.cn/info/1040/11565.htm,唐都医院幼儿园维修改造工程招标公告
2016/06/16,第四军医大学,唐都医院门诊更换LED屏项目招标公告-通知公告网,https://tongzhi.fmmu.edu.cn/info/1040/11625.htm,唐都医院门诊更换LED屏项目招标公告
2016/06/14,第四军医大学,西京医院被服中心烫平机安装场地改造工程招标公告-通知公告网,https://tongzhi.fmmu.edu.cn/info/1040/11619.htm,西京医院被服中心烫平机安装场地改造工程招标公告
2016/06/17,第四军医大学,唐都医院住院部病区、办公室安装门禁系统招标公告-通知公告网,https://tongzhi.fmmu.edu.cn/info/1040/11631.htm,唐都医院住院部病区、办公室安装门禁系统招标公告
2016/06/17,第四军医大学,唐都医院核医学科装修改造工程招标公告-通知公告网,https://tongzhi.fmmu.edu.cn/info/1040/11628.htm,唐都医院核医学科装修改造工程招标公告
2016/06/08,第四军医大学,唐都医院卫生被服采购项目招标公告-通知公告网,https://tongzhi.fmmu.edu.cn/info/1040/11594.htm,唐都医院卫生被服采购项目招标公告
2016/06/23,第四军医大学,唐都医院新建天然气锅炉房工程招标公告-通知公告网,https://tongzhi.fmmu.edu.cn/info/1040/11654.htm,唐都医院新建天然气锅炉房工程招标公告
2016/06/28,第四军医大学,西京医院家属区部分建筑屋面防水维修工程招标公告-通知公告网,https://tongzhi.fmmu.edu.cn/info/1040/11673.htm,西京医院家属区部分建筑屋面防水维修工程招标公告
2016/07/08,第四军医大学,关于骨科手术显微镜等设备器材集中采购结果的公告公示-通知公告网,https://tongzhi.fmmu.edu.cn/info/1040/11711.htm,关于骨科手术显微镜等设备器材集中采购结果的公告公示
2016/07/04,第四军医大学,关于设备器材集中采购结果的公告公示-通知公告网,https://tongzhi.fmmu.edu.cn/info/1040/11694.htm,关于设备器材集中采购结果的公告公示
2016/03/28,第四军医大学,唐都医院核医学科正电子药物制备区GMP改造工程招标公告-通知公告网,https://tongzhi.fmmu.edu.cn/info/1040/11402.htm,唐都医院核医学科正电子药物制备区GMP改造工程招标公告
2016/07/12,第四军医大学,关于网络服务器等项目集中采购的公告公示-通知公告网,https://tongzhi.fmmu.edu.cn/info/1040/11716.htm,关于网络服务器等项目集中采购的公告公示
2016/07/22,第四军医大学,唐都医院设备科瓦屋面改造工程招标公告-通知公告网,https://tongzhi.fmmu.edu.cn/info/1040/11762.htm,唐都医院设备科瓦屋面改造工程招标公告
2016/07/22,第四军医大学,西京医院中心配电室空调系统更新改造工程招标公告-通知公告网,https://tongzhi.fmmu.edu.cn/info/1040/11763.htm,西京医院中心配电室空调系统更新改造工程招标公告
2016/07/22,第四军医大学,关于医学图书等项目集中采购的二次公告公示-通知公告网,https://tongzhi.fmmu.edu.cn/info/1040/11764.htm,关于医学图书等项目集中采购的二次公告公示
2016/08/19,第四军医大学,唐都医院申请公寓楼室外高低压电缆敷设安装企业报名公告-通知公告网,https://tongzhi.fmmu.edu.cn/info/1040/11802.htm,唐都医院申请公寓楼室外高低压电缆敷设安装企业报名公告
2016/08/26,第四军医大学,唐都医院公寓楼室外管网报名公告-通知公告网,https://tongzhi.fmmu.edu.cn/info/1040/11805.htm,唐都医院公寓楼室外管网报名公告
2016/08/09,第四军医大学,训练管理部西安第六干休所综合治理整治工程招标公告-通知公告网,https://tongzhi.fmmu.edu.cn/info/1040/11773.htm,训练管理部西安第六干休所综合治理整治工程招标公告
2016/09/05,第四军医大学,唐都医院东配电室低压断路器工程招标公告-通知公告网,https://tongzhi.fmmu.edu.cn/info/1040/11824.htm,唐都医院东配电室低压断路器工程招标公告
2016/06/07,第四军医大学,西京医院多联机中央空调维保招标公告-通知公告网,https://tongzhi.fmmu.edu.cn/info/1040/11589.htm,西京医院多联机中央空调维保招标公告
2016/09/23,第四军医大学,唐都医院家属区1-16栋暖气、地热水管道改造工程招标公告-通知公告网,https://tongzhi.fmmu.edu.cn/info/1040/11911.htm,唐都医院家属区1-16栋暖气、地热水管道改造工程招标公告
2016/09/28,第四军医大学,口腔医院医疗科研综合楼配电增容工程招标公告-通知公告网,https://tongzhi.fmmu.edu.cn/info/1040/11927.htm,口腔医院医疗科研综合楼配电增容工程招标公告
2016/09/30,第四军医大学,关于美式障碍场等项目集中采购的公告公示-通知公告网,https://tongzhi.fmmu.edu.cn/info/1040/11923.htm,关于美式障碍场等项目集中采购的公告公示
2016/10/11,第四军医大学,训管部西安第五干休所电力增容送配电工程招标公告-通知公告网,https://tongzhi.fmmu.edu.cn/info/1040/11961.htm,训管部西安第五干休所电力增容送配电工程招标公告
2016/10/11,第四军医大学,西京医院进修生公寓3-4层整修工程招标公告-通知公告网,https://tongzhi.fmmu.edu.cn/info/1040/11965.htm,西京医院进修生公寓3-4层整修工程招标公告
2016/06/16,第四军医大学,西京医院住院二部大楼电梯项目招标代理服务机构招标公告-通知公告网,https://tongzhi.fmmu.edu.cn/info/1040/11616.htm,西京医院住院二部大楼电梯项目招标代理服务机构招标公告
2016/10/13,第四军医大学,唐都医院药剂科营具采购项目招标公告-通知公告网,https://tongzhi.fmmu.edu.cn/info/1040/11974.htm,唐都医院药剂科营具采购项目招标公告
2016/09/20,第四军医大学,军职楼竣工结算审计机构选取招标公告-通知公告网,https://tongzhi.fmmu.edu.cn/info/1040/11895.htm,军职楼竣工结算审计机构选取招标公告
2016/10/13,第四军医大学,唐都医院药剂科电梯采购项目招标公告-通知公告网,https://tongzhi.fmmu.edu.cn/info/1040/11977.htm,唐都医院药剂科电梯采购项目招标公告
2016/10/19,第四军医大学,关于拟采用单一来源方式组织集中采购的项目公告-通知公告网,https://tongzhi.fmmu.edu.cn/info/1040/11991.htm,关于拟采用单一来源方式组织集中采购的项目公告
2016/10/27,第四军医大学,西京医院门诊西药房改造工程招标公告-通知公告网,https://tongzhi.fmmu.edu.cn/info/1040/12001.htm,西京医院门诊西药房改造工程招标公告
2016/10/28,第四军医大学,关于拟采用单一来源方式组织集中采购的项目公示-通知公告网,https://tongzhi.fmmu.edu.cn/info/1040/12006.htm,关于拟采用单一来源方式组织集中采购的项目公示
2016/11/03,第四军医大学,西京医院电梯加装安全装置工程招标公告-通知公告网,https://tongzhi.fmmu.edu.cn/info/1040/12018.htm,西京医院电梯加装安全装置工程招标公告
2016/11/03,第四军医大学,西京医院2016-2017年度一般绿化区域维保项目招标公告-通知公告网,https://tongzhi.fmmu.edu.cn/info/1040/12014.htm,西京医院2016-2017年度一般绿化区域维保项目招标公告
2016/11/07,第四军医大学,唐都医院核医学科SPECT/CT改造工程招标公告-通知公告网,https://tongzhi.fmmu.edu.cn/info/1040/12024.htm,唐都医院核医学科SPECT/CT改造工程招标公告
2016/08/03,第四军医大学,第四军医大学万寿路干休所营院综合整治工程招标公告-通知公告网,https://tongzhi.fmmu.edu.cn/info/1040/11768.htm,第四军医大学万寿路干休所营院综合整治工程招标公告
2016/06/17,第四军医大学,西京医院住院一部等区域部分屋面防水维修工程招标公告-通知公告网,https://tongzhi.fmmu.edu.cn/info/1040/11638.htm,西京医院住院一部等区域部分屋面防水维修工程招标公告
2012/06/27,第四军医大学,设备器材集中采购公告-通知公告网,https://tongzhi.fmmu.edu.cn/info/1040/8686.htm,设备器材集中采购公告
2012/09/04,第四军医大学,设备集中采购公告公示-通知公告网,https://tongzhi.fmmu.edu.cn/info/1040/8164.htm,设备集中采购公告公示
2015/11/10,第四军医大学,设备器材集中采购二次公告公示-通知公告网,https://tongzhi.fmmu.edu.cn/info/1040/11020.htm,设备器材集中采购二次公告公示
2015/11/12,第四军医大学,唐都医院干部公寓楼高低压配电招标公告-通知公告网,https://tongzhi.fmmu.edu.cn/info/1040/11031.htm,唐都医院干部公寓楼高低压配电招标公告
2015/11/13,第四军医大学,唐都医院脑科DSA改造工程招标公告-通知公告网,https://tongzhi.fmmu.edu.cn/info/1040/11043.htm,唐都医院脑科DSA改造工程招标公告
2015/11/16,第四军医大学,第四军医大学新校区学员宿舍一区工程沉降观测（第二次）招标公告-通知公告网,https://tongzhi.fmmu.edu.cn/info/1040/11053.htm,第四军医大学新校区学员宿舍一区工程沉降观测（第二次）招标公告
2015/11/11,第四军医大学,唐都医院核医学科改造工程招标公告-通知公告网,https://tongzhi.fmmu.edu.cn/info/1040/11028.htm,唐都医院核医学科改造工程招标公告
2015/12/02,第四军医大学,关于设备器材集中采购结果的公告公示-通知公告网,https://tongzhi.fmmu.edu.cn/info/1040/11102.htm,关于设备器材集中采购结果的公告公示
2015/12/15,第四军医大学,关于陆上划船器项目单一来源采购方式征求意见公示-通知公告网,https://tongzhi.fmmu.edu.cn/info/1040/11129.htm,关于陆上划船器项目单一来源采购方式征求意见公示
2015/12/21,第四军医大学,唐都医院药剂科智能型密集柜招标公告-通知公告网,https://tongzhi.fmmu.edu.cn/info/1040/11146.htm,唐都医院药剂科智能型密集柜招标公告
2015/12/29,第四军医大学,西京医院污水处理站消毒用次氯酸钠采购招标公告-通知公告网,https://tongzhi.fmmu.edu.cn/info/1040/11165.htm,西京医院污水处理站消毒用次氯酸钠采购招标公告
2015/12/31,第四军医大学,西京医院住院二部大楼室内外装饰装修工程施工招标公告-通知公告网,https://tongzhi.fmmu.edu.cn/info/1040/11192.htm,西京医院住院二部大楼室内外装饰装修工程施工招标公告
2016/01/20,第四军医大学,唐都医院住院二部超声科营具招标公告-通知公告网,https://tongzhi.fmmu.edu.cn/info/1040/11251.htm,唐都医院住院二部超声科营具招标公告
2016/03/10,第四军医大学,唐都医院院内空调维保招标公告-通知公告网,https://tongzhi.fmmu.edu.cn/info/1040/11356.htm,唐都医院院内空调维保招标公告
2016/01/21,第四军医大学,设备器材集中采购结果公示-通知公告网,https://tongzhi.fmmu.edu.cn/info/1040/11275.htm,设备器材集中采购结果公示
2016/03/14,第四军医大学,唐都医院疼痛所SPF级动物饲养室净化区空调维保项目招标公告-通知公告网,https://tongzhi.fmmu.edu.cn/info/1040/11363.htm,唐都医院疼痛所SPF级动物饲养室净化区空调维保项目招标公告
2016/03/16,第四军医大学,第四军医大学第三附属医院医生白大衣采购招标公告-通知公告网,https://tongzhi.fmmu.edu.cn/info/1040/11371.htm,第四军医大学第三附属医院医生白大衣采购招标公告
2012/11/08,第四军医大学,第四军医大学唐都医院2013年度专业技术人员招聘简章-通知公告网,https://tongzhi.fmmu.edu.cn/info/1040/8739.htm,第四军医大学唐都医院2013年度专业技术人员招聘简章
2012/11/30,第四军医大学,第四军医大学口腔医院（口腔医学院）诚聘部分科室主任-通知公告网,https://tongzhi.fmmu.edu.cn/info/1040/8744.htm,第四军医大学口腔医院（口腔医学院）诚聘部分科室主任
2012/11/30,第四军医大学,西京医院康复一期装修改造工程招标公告-通知公告网,https://tongzhi.fmmu.edu.cn/info/1040/8355.htm,西京医院康复一期装修改造工程招标公告
2017/01/14,第四军医大学,关于医学图书教材等设备器材集中采购结果的公告公示 -通知公告网,https://tongzhi.fmmu.edu.cn/info/1040/12165.htm,关于医学图书教材等设备器材集中采购结果的公告公示
2012/09/29,第四军医大学,设备集中采购公告公示-通知公告网,https://tongzhi.fmmu.edu.cn/info/1040/8682.htm,设备集中采购公告公示
2017/01/16,第四军医大学,西京医院污水处理站消毒用次氯酸钠采购招标公告-通知公告网,https://tongzhi.fmmu.edu.cn/info/1040/12169.htm,西京医院污水处理站消毒用次氯酸钠采购招标公告
2015/07/02,第四军医大学,长兴饭店院落燃煤锅炉拆除工程招标公告-通知公告网,https://tongzhi.fmmu.edu.cn/info/1040/10644.htm,长兴饭店院落燃煤锅炉拆除工程招标公告
2015/07/06,第四军医大学,第四军医大学万寿路干休所老干部“健康安全监护设备”招标公告-通知公告网,https://tongzhi.fmmu.edu.cn/info/1040/10649.htm,第四军医大学万寿路干休所老干部“健康安全监护设备”招标公告
2012/07/19,第四军医大学,唐都医院诚聘学科带头人-通知公告网,https://tongzhi.fmmu.edu.cn/info/1040/8740.htm,唐都医院诚聘学科带头人
2015/06/30,第四军医大学,第四军医大学新校区道路管网工程施工招标公告-通知公告网,https://tongzhi.fmmu.edu.cn/info/1040/10633.htm,第四军医大学新校区道路管网工程施工招标公告
2015/07/13,第四军医大学,关于设备器材集中采购的公告公示-通知公告网,https://tongzhi.fmmu.edu.cn/info/1040/10674.htm,关于设备器材集中采购的公告公示
2015/07/13,第四军医大学,西京医院通用物资配送服务资格采购公开招标公告-通知公告网,https://tongzhi.fmmu.edu.cn/info/1040/10667.htm,西京医院通用物资配送服务资格采购公开招标公告
2015/07/15,第四军医大学,唐都医院生殖医学中心门诊监控系统招标公告-通知公告网,https://tongzhi.fmmu.edu.cn/info/1040/10680.htm,唐都医院生殖医学中心门诊监控系统招标公告
2012/11/30,第四军医大学,西京医院特诊中心扩建改造工程招标公告-通知公告网,https://tongzhi.fmmu.edu.cn/info/1040/8354.htm,西京医院特诊中心扩建改造工程招标公告
2015/07/06,第四军医大学,关于设备器材集中采购二次公示的通知-通知公告网,https://tongzhi.fmmu.edu.cn/info/1040/10660.htm,关于设备器材集中采购二次公示的通知
2012/12/17,第四军医大学,西京医院高新区干部住宅楼立体智能车库工程招标公告-通知公告网,https://tongzhi.fmmu.edu.cn/info/1040/8353.htm,西京医院高新区干部住宅楼立体智能车库工程招标公告
2013/01/31,第四军医大学,口腔医院医疗-科研综合楼建设工程招聘公告-通知公告网,https://tongzhi.fmmu.edu.cn/info/1040/8743.htm,口腔医院医疗-科研综合楼建设工程招聘公告
2013/03/12,第四军医大学,第四军医大学万寿路干休所“三个中心”综合楼新建工程招标公告-通知公告网,https://tongzhi.fmmu.edu.cn/info/1040/8362.htm,第四军医大学万寿路干休所“三个中心”综合楼新建工程招标公告
2013/03/13,第四军医大学,唐都医院公寓楼设计招标公告-通知公告网,https://tongzhi.fmmu.edu.cn/info/1040/8369.htm,唐都医院公寓楼设计招标公告
2013/03/27,第四军医大学,西京医院住院二部翻建工程方案设计招标公告-通知公告网,https://tongzhi.fmmu.edu.cn/info/1040/8352.htm,西京医院住院二部翻建工程方案设计招标公告
2013/03/27,第四军医大学,唐都医院诚聘学科带头人-通知公告网,https://tongzhi.fmmu.edu.cn/info/1040/8738.htm,唐都医院诚聘学科带头人
2013/04/16,第四军医大学,第四军医大学口腔医院医疗-科研综合楼方案设计招标公告-通知公告网,https://tongzhi.fmmu.edu.cn/info/1040/8370.htm,第四军医大学口腔医院医疗-科研综合楼方案设计招标公告
2013/05/07,第四军医大学,西京医院门诊楼柴油发电机组采购与安装工程招标公告-通知公告网,https://tongzhi.fmmu.edu.cn/info/1040/8350.htm,西京医院门诊楼柴油发电机组采购与安装工程招标公告
2013/07/09,第四军医大学,唐都医院住院三部改造工程招标公告-通知公告网,https://tongzhi.fmmu.edu.cn/info/1040/8368.htm,唐都医院住院三部改造工程招标公告
2013/07/17,第四军医大学,第四军医大学第一附属医院升降横移式立体停车库工程招标公告-通知公告网,https://tongzhi.fmmu.edu.cn/info/1040/8349.htm,第四军医大学第一附属医院升降横移式立体停车库工程招标公告
2013/07/22,第四军医大学,西京医院手术敷料、卫生被服招标公告-通知公告网,https://tongzhi.fmmu.edu.cn/info/1040/8348.htm,西京医院手术敷料、卫生被服招标公告
2015/07/22,第四军医大学,唐都医院门禁管理实施车牌识别技术改造工程招标公告-通知公告网,https://tongzhi.fmmu.edu.cn/info/1040/10698.htm,唐都医院门禁管理实施车牌识别技术改造工程招标公告
2015/07/24,第四军医大学,关于设备器材集中采购结果的公告公示-通知公告网,https://tongzhi.fmmu.edu.cn/info/1040/10711.htm,关于设备器材集中采购结果的公告公示
2015/07/31,第四军医大学,关于设备器材集中采购结果的公示-通知公告网,https://tongzhi.fmmu.edu.cn/info/1040/10742.htm,关于设备器材集中采购结果的公示
2013/06/26,第四军医大学,设备器材集中采购公告-通知公告网,https://tongzhi.fmmu.edu.cn/info/1040/7120.htm,设备器材集中采购公告
2015/07/31,第四军医大学,第四军医大学二区食堂厨房设备及安装招标公告-通知公告网,https://tongzhi.fmmu.edu.cn/info/1040/10767.htm,第四军医大学二区食堂厨房设备及安装招标公告
